{
  "$schema": "https://json-schema.org/draft/2020-12/schema",
  "title": "Locations",
  "type": "array",
  "items": {
    "type": "object",
    "required": ["id", "name", "latitude", "longitude", "precision"],
    "properties": {
      "id": {"type": "string"},
      "name": {"type": "string"},
      "latitude": {"type": "number", "minimum": -90, "maximum": 90},
      "longitude": {"type": "number", "minimum": -180, "maximum": 180},
      "precision": {"type": "string"}
    }
  }
}
